{
  "schema_version": 1,
  "id": "900-sample",
  "type": "story",
  "title": "Filter account statements by date range",
  "jira": {
    "key": "DEMO-101",
    "issue_type": "Story",
    "project_key": "DEMO",
    "parent_key": "DEMO-100",
    "labels": [
      "statements"
    ],
    "components": [
      "accounts-api"
    ],
    "links": [
      {
        "relation": "relates to",
        "key": "DEMO-102"
      }
    ]
  },
  "refines": {
    "key": "DEMO-101",
    "changes": [
      {
        "field": "acceptance_criteria",
        "summary": "Replaced 'works for any dates' with three Given/When/Then criteria",
        "reason": "The original criterion was not testable"
      }
    ]
  },
  "user_story": {
    "as_a": "retail banking customer",
    "i_want": "to list my statements for a date range",
    "so_that": "I can find last quarter's statements without paging through all of them"
  },
  "context": "Statements are served by `StatementController.find` at `GET /accounts/{accountId}/statements`, which returns every statement for the account, newest first.",
  "acceptance_criteria": [
    {
      "id": "AC1",
      "kind": "happy",
      "given": "account A has statements dated 2026-01-31, 2026-02-28 and 2026-03-31",
      "when": "its owner calls GET /accounts/A/statements?from=2026-02-01&to=2026-03-31",
      "then": "the response is 200 with exactly the 2026-02-28 and 2026-03-31 statements, newest first"
    },
    {
      "id": "AC2",
      "kind": "error",
      "given": "any account owned by the caller",
      "when": "the caller sends a from date later than the to date",
      "then": "the response is 400 with error code INVALID_DATE_RANGE"
    },
    {
      "id": "AC3",
      "kind": "security",
      "given": "account B belongs to another customer",
      "when": "the caller requests GET /accounts/B/statements?from=2026-01-01&to=2026-03-31",
      "then": "the response is 404, the same as without the filter"
    }
  ],
  "tech_notes": [
    "Filter in the repository query, not in memory.",
    "Dates are inclusive calendar dates."
  ],
  "api_impact": [
    {
      "contract": "accounts-api:openapi.json",
      "operation": "GET /accounts/{accountId}/statements",
      "change": "modify",
      "breaking": "no",
      "detail": "Add optional query parameters from and to (format: date)."
    }
  ],
  "out_of_scope": [
    "Filtering by amount or statement type",
    "Mobile app UI"
  ],
  "dependencies": [],
  "assumptions": [
    {
      "text": "Either parameter may be sent alone",
      "kind": "technical"
    }
  ],
  "open_questions": [],
  "risk_flags": [],
  "sources": [
    {
      "kind": "jira",
      "ref": "DEMO-101",
      "note": "original ticket"
    },
    {
      "kind": "code",
      "ref": "accounts-api:src/controllers/statement.controller.ts",
      "note": "find()"
    },
    {
      "kind": "openapi",
      "ref": "accounts-api:openapi.json",
      "note": "GET /accounts/{accountId}/statements"
    }
  ],
  "extra": {},
  "meta": {
    "round": 1,
    "blocked": null,
    "revision_log": []
  }
}
